{
  "$schema": "../schema/baby-pai.state.v1.json",
  "id": "credits-exhausted",
  "role": "error",
  "title": "Power user, credits at zero, Gold upgrade modal open",

  "surface": "Upgrade-to-Pro modal",
  "register": "Growth",

  "seed": 7,
  "now": "2026-07-28T09:00:00Z",

  "user": {
    "name": "Priya Nair",
    "initials": "PN",
    "workspace": "Foursquare",
    "locale": "en-US",
    "plan_id": "pro",
    "plan_period": "annual",
    "tenure_days": 412,
    "trial": null,
    "credits": { "included": 500, "used": 500, "resets_in_days": 12 },
    "team": { "in_team": true, "role": "owner", "seats_total": 5, "seats_used": 5 }
  },

  "content": {
    "decks":    { "$ref": "../fixtures.json#/decks", "take": 24, "starred": [0, 2] },
    "projects": { "$ref": "../fixtures.json#/projects" },
    "members":  { "$ref": "../fixtures.json#/members", "take": 5 }
  },

  "location": { "route": "/dashboard", "surface": "dashboard", "focus": null },

  "overlays": {
    "modal": {
      "id": "upgrade-gold",
      "reason": "credits-exhausted",
      "dismissible": true,
      "offer_id": null,
      "highlight_plan": "gold"
    },
    "banner": null,
    "toast": null
  },

  "flags": { "gold_launch": true, "regenerate_v2": false },

  "continuity": {
    "entered_from": { "scenario": "credits-low", "click": "[data-testid=credits-chip]" },
    "on_dismiss":   "credits-exhausted-dismissed",
    "on_primary":   "checkout-gold",
    "on_secondary": "credits-exhausted-dismissed"
  }
}
