{
  "$schema": "../schema/baby-pai.state.v1.json",
  "id": "trial-expiring",
  "role": "default",
  "title": "Trial user, 2 days from expiry, in the editor",

  "surface": "Slide editor",
  "register": "App",

  "seed": 3,
  "now": "2026-07-28T09:00:00Z",

  "user": {
    "name": "Dan Whitby",
    "initials": "DW",
    "workspace": "Whitby & Co",
    "locale": "en-GB",
    "plan_id": "pro",
    "plan_period": "trial",
    "tenure_days": 12,
    "trial": { "days_remaining": 2, "of": 14, "converts_to": "pro", "card_on_file": false },
    "credits": { "included": 500, "used": 337, "resets_in_days": 2 },
    "team": { "in_team": false, "role": null, "seats_total": 1, "seats_used": 1 }
  },

  "content": {
    "decks":  { "$ref": "../fixtures.json#/decks", "take": 4 },
    "slides": { "$ref": "../fixtures.json#/slides", "take": 8 }
  },

  "location": {
    "route": "/editor/series-b-foursquare",
    "surface": "editor",
    "focus": { "deck": 0, "slide": 3 }
  },

  "overlays": {
    "modal": null,
    "banner": { "id": "trial-ending", "tone": "warning", "dismissible": true, "cta": "add-card" },
    "toast": null
  },

  "flags": { "gold_launch": true, "regenerate_v2": true },

  "continuity": {
    "entered_from": { "scenario": "trial-active", "click": "[data-testid=deck-card-0]" },
    "on_primary": "checkout-pro",
    "on_dismiss": "trial-expiring-banner-dismissed"
  }
}
