{
  "$schema": "../schema/baby-pai.state.v1.json",
  "id": "empty",
  "role": "empty",
  "title": "Brand-new free user, zero decks, dashboard empty state",

  "surface": "Empty states",
  "register": "App",

  "seed": 1,
  "now": "2026-07-28T09:00:00Z",

  "user": {
    "name": "Sam Okafor",
    "initials": "SO",
    "workspace": "Sam's workspace",
    "locale": "en-US",
    "plan_id": "free",
    "plan_period": null,
    "tenure_days": 0,
    "trial": null,
    "credits": { "included": 20, "used": 0, "resets_in_days": 30 },
    "team": { "in_team": false, "role": null, "seats_total": 1, "seats_used": 1 }
  },

  "content": {
    "decks": [],
    "projects": [],
    "members": { "$ref": "../fixtures.json#/members", "take": 1 }
  },

  "location": { "route": "/dashboard", "surface": "dashboard", "focus": null },

  "overlays": { "modal": null, "banner": null, "toast": null },

  "flags": { "gold_launch": true, "regenerate_v2": false },

  "continuity": {
    "entered_from": { "scenario": null, "click": null },
    "on_primary": "generating"
  }
}
